{
  "credential_id": "credential_synthetic",
  "intent_digest": "sha256:29206f6a501eb2c0c82d63489245d81d4c6ad93b6d2f73e0b6237c1e68c0e074",
  "message_type": "segment_upload_intent",
  "protocol_version": "tacua.sdk-backend@1.0.0",
  "requested_at": "2026-07-21T10:01:59Z",
  "scope_digest": "sha256:c38600d56cdb3bc8a0d94c0dd7e6323f863d1ccbc6953b6c71421e7c08512a20",
  "segment_id": "segment_synthetic",
  "sequence": 0,
  "session_id": "session_synthetic",
  "sidecar_digest": "sha256:4444444444444444444444444444444444444444444444444444444444444444",
  "transport": {
    "content_digest": "sha256:3333333333333333333333333333333333333333333333333333333333333333",
    "content_type": "video/quicktime",
    "size_bytes": 2048
  },
  "upload_id": "upload_segment_synthetic"
}
